{
  "$schema": "./schemas/puzzle-quality.schema.json",
  "schema_version": "2.0",
  "description": "Quality level definitions for puzzle data completeness rating. Scale: 1=worst, 5=best (matches source-quality.json).",
  "last_updated": "2026-03-19",
  "changelog": [
    {
      "version": "2.0",
      "date": "2026-03-19",
      "author": "unknown",
      "changes": "Added display configuration with star/level colors."
    },
    {
      "version": "1.0",
      "date": "unknown",
      "author": "initial",
      "changes": "Initial 5-level quality system."
    }
  ],
  
  "levels": {
    "1": {
      "name": "unverified",
      "display_label": "Unverified",
      "stars": 1,
      "description": "Problem setup only - solution not yet verified in our system",
      "requirements": {},
      "selection_weight": 0.1
    },
    "2": {
      "name": "basic",
      "display_label": "Basic",
      "stars": 2,
      "description": "Solution tree present but no refutation branches",
      "requirements": {
        "has_solution_tree": true
      },
      "selection_weight": 0.5
    },
    "3": {
      "name": "standard",
      "display_label": "Standard",
      "stars": 3,
      "description": "Valid solution with at least one refutation branch",
      "requirements": {
        "refutation_count_min": 1
      },
      "selection_weight": 1.0
    },
    "4": {
      "name": "high",
      "display_label": "High",
      "stars": 4,
      "description": "Complete solution with good refutation coverage and comments",
      "requirements": {
        "refutation_count_min": 2,
        "min_comment_level": 1,
        "min_ac": 1
      },
      "selection_weight": 2.0
    },
    "5": {
      "name": "premium",
      "display_label": "Premium",
      "stars": 5,
      "description": "Full solution tree with multiple lines, rich refutations, and explanatory comments",
      "requirements": {
        "refutation_count_min": 3,
        "min_comment_level": 1,
        "min_ac": 2
      },
      "selection_weight": 3.0
    }
  },
  
  "display": {
    "star_colors": {
      "filled": "#FFD700",
      "empty": "#CCCCCC"
    },
    "level_colors": {
      "1": "#F44336",
      "2": "#FF9800",
      "3": "#9E9E9E",
      "4": "#2196F3",
      "5": "#4CAF50"
    }
  }
}
